{
  "$schema": "http://json-schema.org/draft-07/schema#",
  "title": "Region",
  "description": "The scale above a field map: a country rather than a walk. A region says what kind of place this is and what lives there; the field maps under it say where the player can actually stand. Regions were entirely unvalidated until the overworld needed them -- seven files, no schema, nothing checking that `continent` or `canon` said anything sensible.",
  "type": "object",
  "required": [
    "id",
    "type",
    "name",
    "continent"
  ],
  "properties": {
    "id": {
      "type": "string",
      "pattern": "^region_[a-z0-9_]+$"
    },
    "type": {
      "const": "region"
    },
    "name": {
      "type": "string",
      "minLength": 1
    },
    "continent": {
      "type": "string",
      "description": "Which landmass. Everything authored so far is on jambhudweepa; the field is here rather than assumed so a second continent does not need a migration.",
      "minLength": 1
    },
    "bestiary_region": {
      "type": "string",
      "description": "The key species files use for `region`. Deliberately not the entity id: the bestiary was written first and its own vocabulary is what the fauna and flora carry."
    },
    "biomes": {
      "type": "array",
      "description": "Which biomes occur here. Advisory rather than binding -- a field map's `seed_biomes` is what the generator actually draws from.",
      "items": {
        "type": "string",
        "enum": [
          "sea",
          "coast",
          "plains",
          "forest",
          "wetland",
          "hills",
          "mountains",
            "snow",
          "desert",
          "river",
          "settlement",
          "landmark",
          "sky_island",
          "sky_underside",
          "open_sky",
          "underworld",
          "lava_field"
        ]
      }
    },
    "extent": {
      "type": "array",
      "description": "The ground this covers, as a closed ring of [x, y] points on the same abstract 0-100 grid the field maps use.\n\nTraced off `dump/Partial_map.png`, which is the only picture canon has of its own geography. Approximate on purpose: it is a schematic of where things are relative to each other, not a survey, and it is read to about three units.\n\n**This is the world before the Great Shattering.** The three field-map coordinates are not on it and are not meant to be -- `field_map.schema.json` records that their layout is cataclysm-shaped, and the map's own arrangement disagrees with them: it puts Dwarka and the Narmada country at nearly one latitude where the grid spreads them from y=64 to y=20. That is the Shattering having happened in between, not an error in either.",
      "minItems": 3,
      "items": {
        "type": "array",
        "minItems": 2,
        "maxItems": 2,
        "items": {
          "type": "number",
          "minimum": 0,
          "maximum": 100
        }
      }
    },
    "biomes_note": {
      "type": "string"
    },
    "habitats": {
      "type": "array",
      "items": {
        "type": "string"
      }
    },
    "settlements": {
      "type": "array",
      "items": {
        "type": "string"
      }
    },
    "landmarks": {
      "type": "array",
      "items": {
        "type": "string"
      }
    },
    "notes": {
      "type": "string"
    },
    "canon": {
      "type": "string",
      "enum": [
        "primary",
        "secondary",
        "inferred"
      ],
      "description": "How firmly this is established. `primary` is stated by the source material, `inferred` is a reading canon has committed to."
    },
    "sources": {
      "type": "array",
      "items": {
        "type": "string"
      }
    }
  },
  "additionalProperties": false
}
